	label	sentence	pos	v_index
879	1	Inshort,  if life was always harder in the inner cities than elsewhere,  and if conditions may temporarily have been alleviated by the impact of the welfare state and rising incomes,  the last decade has been widely represented as a period of deterioration.	verb	36
880	1	Or on the social or physical environment—  the replacement of companionably unhygienic slums by soulless tower blocks with broken lifts ( Coleman.,	verb	10
881	1	Or on the social or physical environment—  the replacement of companionably unhygienic slums by soulless tower blocks with broken lifts ( Coleman.,	verb	14
882	1	Or would a simple injection of resources transform Kafkaesque honeycombs into happy living-spaces,  with a consequent decline in inner-city ills?	verb	4
883	1	Or would a simple injection of resources transform Kafkaesque honeycombs into happy living-spaces,  with a consequent decline in inner-city ills?	verb	9
884	1	The picture painted by the Commission 's report on inner London is as gruesome as any ever presented ( and is itself revealing of common prejudices in its choice of indicators of deprivation ):	verb	17
885	1	The Government 's post-1987 initiatives have,  to some extent,  reflected a diagnosis based on the need for better management—  though on the principle that central authorities can provide a firmer grip than local ones—  but combined with an anti-collectivist belief in the restorative powers of capitalism.	verb	11
886	1	the encouragement of private investment and the liberation of the market;  the containment of the forces of social discontent;  the control of the powers of the local authorities;  and the encouragement of the movement of the wealthy into the inner city thus creating buffer areas of Tory support,  accentuating inequalities and injustice and ( hopefully though not necessarily ) reducing the potential for conflict among the urban poor.	verb	48
887	1	The main thrust of the Government 's policy is contained in the January 1988 White Paper on Regional Policy and the Enterprise Economy,  in the new Employment Training programme,  and especially in the March 1988 programme—  all resting on wider reforms to local government structure and finance,  and to education and housing.	verb	2
888	1	The most striking feature of this package,  apartfrom its aim actively to involve employers and entrepreneurs,  is a sharp reduction in the role of local government.	verb	19
889	1	The Urban Programme consisted of grants and initiatives under the 1969 Local Government Grants ( Social Need ) Act,  which was intended as a flexible instrument to provide supplementary help to local authorities in the fields of housing,  education,  and health.	verb	25
890	1	The Urban Programme consisted of grants and initiatives under the 1969 Local Government Grants ( Social Need ) Act,  which was intended as a flexible instrument to provide supplementary help to local authorities in the fields of housing,  education,  and health.	verb	35
891	1	True,  the new Secretary of State for the Environment laid stress,  from the outset,  on the need for economic regeneration,  and indicated his sympathy for the voluntary sector in the tackling of urban problems.	verb	19
892	1	True,  the new Secretary of State for the Environment laid stress,  from the outset,  on the need for economic regeneration,  and indicated his sympathy for the voluntary sector in the tackling of urban problems.	verb	28
893	1	became his slogan—  the partnership of public and private brains and money.	verb	4
894	1	Heseltine 's vision was of ‘ partnerships which recognise that there are some things that only governments can pay for,  but also that the ingenuity and flexibility of the private sector is indispensable ’ ( p. 156 ).	verb	26
895	1	He claims that serious work on inner-city policy began in 1979:  but it was,  undoubtedly,  the riots of 1981,  coinciding with the biggest drop in employment and job vacancies since the war,  which gave impetus to the new approach.	verb	34
896	1	Conservative instincts were,  ofcourse,  to minimize—  within the ‘ partnership—  state involvement and expenditure,  relativeto that of private enterprise.	verb	9
897	1	The increased scale of operations also ushered in another fashion of the 1980s—  new management structures.	verb	6
898	1	By 1986/7 the Urban Programme was supporting 1,380 starter units and 400 business starts in enterprise workshops.	verb	16
899	1	It was providing 27,500 training places ( often inconjunctionwith the Manpower Services Commission ):  some 2,500 buildings were being improved;  estate action aimed to tackle run down housing;  and a large number of new ‘ partnerships ’ ( which some might see as subsidies,  or discredited regional grants,  in a new guise ) were in operation,  in an effort to bring private investment to run-down urban areas.	verb	45
900	1	By 1988 it was claimed that £200 million of Urban Development Grant and Urban Regeneration Grant had successfully ‘ levered ’ morethan £800 million of private investment into the inner cities ( although how much of the latter sum might have been invested in any case is difficult to say ).	verb	14
901	1	By 1988 it was claimed that £200 million of Urban Development Grant and Urban Regeneration Grant had successfully ‘ levered ’ morethan £800 million of private investment into the inner cities ( although how much of the latter sum might have been invested in any case is difficult to say ).	verb	19
902	1	It is a curious comment on Thatcherism,  however,  that the administration most committed to a reduction in the role of the state,  and in the need for an independent private sector,  has spent more on urban regeneration and employment schemes and incentives to private investment in urban areas than any other in recent history.	verb	36
903	1	One of the most bizarre aspects of government policy has been the effective murder of the voluntary sector,  and its appropriation,  by subterfuge,  into the Tory version of the corporate state.	verb	13
904	1	One of the most bizarre aspects of government policy has been the effective murder of the voluntary sector,  and its appropriation,  by subterfuge,  into the Tory version of the corporate state.	verb	20
905	1	One of the most bizarre aspects of government policy has been the effective murder of the voluntary sector,  and its appropriation,  by subterfuge,  into the Tory version of the corporate state.	verb	26
906	1	Faced,  however,  with the catastrophic increase in unemployment and the need to occupy large numbers of workless people without directly employing them ( which would have run counter to the economic doctrine which had led to the redundancy of many of them in the first place ),  the Government poured money into any ‘ voluntary ’ agency willing to put in a bid for government-funded cheap labour.	verb	27
907	1	One result was the triumphant expansion of some charitable organizations,  which rejoiced both at their new-found importance and at the Government 's munificence.	verb	4
908	1	One result was the triumphant expansion of some charitable organizations,  which rejoiced both at their new-found importance and at the Government 's munificence.	verb	11
909	1	Another was the transformation of many such bodies,  already heavily subsidized from public funds,  into agencies of the state,  which financed them and indirectly determined their policy.	verb	9
910	1	Nowhere was the impact of this clumsy sleight of hand more evident than in the inner cities,  where voluntary organizations had been most active,  and where the Government was most anxious for them to mop up unemployment.	verb	7
911	1	However,  the later withdrawal of government support,  with the scrapping of the Community Programme as unemployment receded,  left many of these voluntary organizations high and dry.	verb	9
912	1	However,  the later withdrawal of government support,  with the scrapping of the Community Programme as unemployment receded,  left many of these voluntary organizations high and dry.	verb	16
913	1	The main issues that were prominent in debates during 1980–1 were ‘ race ’ and ‘ law and order ’.	verb	5
914	1	This was bynomeans an accident,  since throughout the 1970s a powerful body of media,  political,  and academic opinion had been constructed around the theme of how Britain was drifting into a ‘ violent society ’,  and how the basis of consent was being shifted by the pressures of immigration and the growth of multi-racial inner city areas.	verb	20
915	1	The first took place in the midst of the July 1981 riots,  and had as its theme:  ‘ Civil Disturbances ’.	verb	6
916	1	The ‘ scourge of criminal violence ’ was,  Whitelaw argued,  a danger to the whole framework of consent and legality on which the political institutions of British society were based.	verb	2
917	1	In reply Roy Hattersley supported the call for the immediate suppression of street violence,  but warned that the roots of such riots could not be dealt with until all people felt they had a stake in British society ( ibid.:  cols. 1407–9 )	verb	10
918	1	The importance of the riots in pushing the law and order issue,  and specifically policing,  onto the main political agenda was emphasized by the Liberal leader,  David Steel,  who argued that ‘ urgent action ’ to prevent a drift into lawlessness was necessary from both a moral and a political perspective (,  vol. 13,  26 November 1981:  cols. 1009–11 ).	verb	21
919	1	A subsequent debate on the same issue in March 1982 was also full of references to the experience of 1981,  the impact of street violence,  crime,  decaying urban conditions,  the breakdown of consent between the police and many local communities,  and the spectre of ‘ more violence to come ’ if changes in both policing tactics and social policy were not swiftly introduced (,  vol. 20,  25 March 1982:  cols. 1107–81 ).	verb	26
920	1	A subsequent debate on the same issue in March 1982 was also full of references to the experience of 1981,  the impact of street violence,  crime,  decaying urban conditions,  the breakdown of consent between the police and many local communities,  and the spectre of ‘ more violence to come ’ if changes in both policing tactics and social policy were not swiftly introduced (,  vol. 20,  25 March 1982:  cols. 1107–81 ).	verb	42
921	1	Throughout 1980 and 1981 debates about the riots in the media,  in Parliament,  and in various official reports hinged around the interrelationship between racial,  law-and-order,  and social factors.	verb	18
922	1	The importance of this debate can be explained,  partly,  by the political capital which the Opposition could make from linking the social and economic malaise of the country atlarge with violent street disturbances.	verb	24
923	1	During the 16 July parliamentary debate on ‘ Civil Disturbances ’,  Roy Hattersley 's formulation of this linkage provided a useful summary of the ‘ social conditions ’ argument.	verb	17
924	1	The final symbolic cue used to make sense of the 1980–1 protests is more difficult to categorize,  but its basic meaning can be captured by the term ‘ political marginality ’.	verb	3
925	1	The final symbolic cue used to make sense of the 1980–1 protests is more difficult to categorize,  but its basic meaning can be captured by the term ‘ political marginality ’.	verb	23
926	1	Nevertheless,  during the 1980–1 events and their aftermath the political context was discussed from a number of perspectives.	verb	10
927	1	The Scarman Report,  forexample,  located part of the explanation for the riots in the feelings of alienation and powerlessness which were experienced by young blacks living in depressed inner-city areas.	verb	18
928	1	A successful policy for tackling the roots of urban disorder was seen as one which sought to involve all the community in dealing with the problems of each area sothat they could come to feel that they have a stake in its future ( Scarman,  1981,  para. 6.42 ).	verb	4
929	1	But the concern with overcoming political marginality remained on the sidelines of the main public debate because it questioned the perception of the rioters as driven by irrational,  uncivilized,  and criminal instincts.	verb	10
930	1	Aspects of these measures are considered further on in the chapter.	verb	0
931	1	There are many continuities between 1980–1 and 1985 inrelationto the common-sense images used in the press and television to cover the events.	verb	3
932	1	During the 1985 riots and their immediate aftermath,  the imagery of ‘ race ’ was used by sections of the press without the sense of ambiguity which could still be found in 1980–1.	verb	9
933	1	The ‘ silence over race ’ was breached in 1980–1,  but in 1985 debate about racial issues was taken a step further.	verb	7
934	1	To be sure there was still a strong response opposing Enoch Powell 's call for repatriation,  from all shades of political opinion,  but the racialization of public debate about the 1985 riots went much further than 1980–1.	verb	18
935	1	The imagery of the ‘ black bomber,  used in Handsworth was extended to the notion that there were groups of alienated and criminalized young blacks who saw the riots as a chance to engage in an ‘ orgy of looting ’.	verb	37
936	1	Indeed,  throughout September and October 1985,  and during the following months,  the imagery of race continued to dominate debate about both the causes and the policy outcomes of the riots.	verb	12
937	1	During 1985 this issue was raised onceagain,  though by then the extent of mass unemployment and urban de-industrialization and decay was more stark than it had been in 198l.	verb	22
938	1	Images of ‘ urban decay ’,  ‘ tinderbox cities ’,  and ‘ ghetto streets ’ linked up with the images of ‘ race inequality ’ and ‘ black ghettos ’ to produce an analysis more complex but also more contradictory.	verb	4
939	1	Images of ‘ urban decay ’,  ‘ tinderbox cities ’,  and ‘ ghetto streets ’ linked up with the images of ‘ race inequality ’ and ‘ black ghettos ’ to produce an analysis more complex but also more contradictory.	verb	7
940	1	Images of ‘ urban decay ’,  ‘ tinderbox cities ’,  and ‘ ghetto streets ’ linked up with the images of ‘ race inequality ’ and ‘ black ghettos ’ to produce an analysis more complex but also more contradictory.	verb	28
941	1	An interesting mixture of the various images was provided by a story in the under the headline:  ‘ Broadwater Farm:  Like the Divis Flats with Reggae ’ ( 8 October 1985 ).	verb	22
942	1	An interesting mixture of the various images was provided by a story in the under the headline:  ‘ Broadwater Farm:  Like the Divis Flats with Reggae ’ ( 8 October 1985 ).	verb	25
943	1	Even the,  which deployed the clearest use of ‘ race ’ and ‘ outside agitator ’ arguments,  ran a major story on Broadwater Farm under the headline:  ‘ Burnt-out hulks litter this concrete jungle…  despair hangs heavy ’ ( 8 October 1985 ).	verb	3
944	1	Even the,  which deployed the clearest use of ‘ race ’ and ‘ outside agitator ’ arguments,  ran a major story on Broadwater Farm under the headline:  ‘ Burnt-out hulks litter this concrete jungle…  despair hangs heavy ’ ( 8 October 1985 ).	verb	33
945	1	The ‘ cities of inner despair ’ were conceived as the breeding ground for disorderly protest,  and however hard the Government tried to break the causal link between the two,  it was forced to take onboard the need to restore order not only through the police but through promises of help for the inner cities.	verb	14
946	1	The ‘ cities of inner despair ’ were conceived as the breeding ground for disorderly protest,  and however hard the Government tried to break the causal link between the two,  it was forced to take onboard the need to restore order not only through the police but through promises of help for the inner cities.	verb	35
947	1	The general form relied on the argument that the riots were not a form of protest against the insufferable social conditions of inner-city areas or the actions of the police,  but a ‘ criminal act ’ or a ‘ cry for loot ’.	verb	41
948	1	First,  it distanced the riots from the social,  economic,  political,  and other grievances which had been linked to them by locating the cause outside the ‘ social problems ’ of inner-city dwellers and in the ‘ simple greed ’ of the drug barons to accumulate ‘ loot ’.	verb	42
949	1	The issue of drugs provided an everyday image,  already a national issue through saturation media coverage and public debate,  around which the police,  the Home Office,  and other institutions could depoliticize the riots.	verb	13
950	1	The issue of drugs provided an everyday image,  already a national issue through saturation media coverage and public debate,  around which the police,  the Home Office,  and other institutions could depoliticize the riots.	verb	30
951	1	Responding to the Handsworth events Douglas Hurd was moved to argue forcibly that such events were senseless and reflected more on those who participated in them than on the society in which they took place:  ‘ The sound which law abiding people in Handsworth heard on Monday night,  the echoes of which I picked up on Tuesday,  was not a cry for help but a cry for loot ’ (,  13 September 1985 ).	verb	11
952	1	Responding to the Handsworth events Douglas Hurd was moved to argue forcibly that such events were senseless and reflected more on those who participated in them than on the society in which they took place:  ‘ The sound which law abiding people in Handsworth heard on Monday night,  the echoes of which I picked up on Tuesday,  was not a cry for help but a cry for loot ’ (,  13 September 1985 ).	verb	49
953	1	Responding to the Handsworth events Douglas Hurd was moved to argue forcibly that such events were senseless and reflected more on those who participated in them than on the society in which they took place:  ‘ The sound which law abiding people in Handsworth heard on Monday night,  the echoes of which I picked up on Tuesday,  was not a cry for help but a cry for loot ’ (,  13 September 1985 ).	verb	65
954	1	Responding to the Handsworth events Douglas Hurd was moved to argue forcibly that such events were senseless and reflected more on those who participated in them than on the society in which they took place:  ‘ The sound which law abiding people in Handsworth heard on Monday night,  the echoes of which I picked up on Tuesday,  was not a cry for help but a cry for loot ’ (,  13 September 1985 ).	verb	67
955	1	He drew the conclusion from this that the riot ‘ came like a bolt outof the blue ’ (,  21 November 1985 ).	verb	13
956	1	It would be naive to expect to uncover any ultimate explanation or basic cause for criminal behaviour,  given the extensive and diverse behaviour that is encompassed by the term crime.	verb	25
957	1	The individual criminal is born so;  and this is usually put down to ‘ faulty chromosome patterns ’,  or,  more vaguely,  to ‘ hereditary traits ’.	verb	23
958	1	In the medical faculty at the University of Rome there is a gallery of portraits of splendidly ugly delinquents who were used to illustrate Lombroso 's theory.	verb	23
959	1	Thus were explained anatomically the enormous jaws,  high cheek bones,  prominent superciliary arches,  solitary lines on the palms,  extreme size of the orbits,  handle shaped or sessile ears found in criminals,  savages and apes,  insensibility of pain,  extremely acute sight,  tattooing,  excessive idleness,  love of orgies and the craving for evil for its own sake…	verb	22
960	1	Thus were explained anatomically the enormous jaws,  high cheek bones,  prominent superciliary arches,  solitary lines on the palms,  extreme size of the orbits,  handle shaped or sessile ears found in criminals,  savages and apes,  insensibility of pain,  extremely acute sight,  tattooing,  excessive idleness,  love of orgies and the craving for evil for its own sake…	verb	26
961	1	Thus were explained anatomically the enormous jaws,  high cheek bones,  prominent superciliary arches,  solitary lines on the palms,  extreme size of the orbits,  handle shaped or sessile ears found in criminals,  savages and apes,  insensibility of pain,  extremely acute sight,  tattooing,  excessive idleness,  love of orgies and the craving for evil for its own sake…	verb	31
962	1	Most advocates of biological theories do not express themselves in the same bizarre language and style as Lombroso,  and such theories of crime are not merely historical relics that died with Lombroso.	verb	29
963	1	Furthermore,  it has been found that the association between delinquency on the one hand and height,  weight and physique on the other is greatly reduced once social,  background factors are taken into account.	verb	27
964	1	An example of this more sophisticated biological approach is the work of Hans Eysenck,  who has argued in a series of studies,  that there is a link between genetically based personality characteristics and criminal behaviour.	verb	5
965	1	An individual 's degree of extroversion or introversion is inherited,  determined by his or her genetic make-up.	verb	16
966	1	While some genetic influence can not be ruled out,  just what is inherited remains very unclear.	verb	12
967	1	The majority of offenders do not come from disturbed or broken homes,  and many broken homes do not produce delinquents.	verb	8
968	1	The problem with assessing the influence of parental and family dimensions,  suchas weak supervision or parental criminality,  is the fact that they are closely linked to various aspects of social and economic disadvantage,  suchas poverty,  overcrowding and poor housing.	verb	3
969	1	They are based on the idea that criminal behaviour is either inherited or a consequence of unique,  individual experiences.	verb	11
970	1	While some offenders suffer from mental disorders the vast majority do not.	verb	8
971	1	Furthermore,  if criminals are abnormal then it follows that a large proportion of the population must also be abnormal.	verb	7
972	1	In Chapter One,  it was stressed that crime can not be considered asidefrom its social context,  that it is dependent on society defining certain actions as criminal,  and on the reaction of others to such actions.	verb	15
973	1	Given the extent to which geographic information management is applications driven,  it is important to consider in some depth the characteristics of some potential application fields.	verb	25
974	1	In the process it will be necessary to examine not only the extent to which geographic issues feature on the policy issues agenda in these fields but also the institutional context which governs decision-making and the extent to which data are available for research and policy analysis purposes.	verb	30
975	1	Questions on data availability are likely to be particularly important where users are heavily dependent on secondary sources.	verb	13
976	1	In situations of this kind provisions governing access and format may exert powerful constraints on the use that can be made of these data.	verb	6
977	1	The first four chapters in this part examine issues relating to geographic information handling intermsof four potential applications fields.	verb	13
978	1	The authors were asked to review the current state of the art in their fields with particular reference to the likely requirements of the future policy issues agenda intermsof the demands that they make on geographic information management.	verb	11
979	1	In this way the chapters in this part present a number of perspectives which essentially complement and amplify the discussion in the previous part.	verb	12
980	1	In effect the product of the discussion in both parts is a matrix where the methodological issues are listed along one axis and particular applications fields on the other.	verb	21
981	1	In effect the product of the discussion in both parts is a matrix where the methodological issues are listed along one axis and particular applications fields on the other.	verb	24
982	1	Brown 's chapter on geodemographics discusses an application field where primary data collected for operational purposes are typically evaluated inrelationto secondary data derived from sources suchas the Census of Population.	verb	7
983	1	The range of data sets involved and the demands that are made on GIS technology in applications of this kind are often more limited than those of previous applications fields.	verb	28
984	1	The boundaries EDs have not been widely digitized,  unlike the higher level electoral wards.	verb	1
985	1	Furthermore,  the scales at which population estimates are often required means that even EDs are too coarse for risk assessments.	verb	19
986	1	A useful research exercise would be to compare the use of census and PAC data in deriving quantitative risk assessments and this is an interesting research problem.	verb	16
987	1	Even with PAC data some assumptions would need to be made about numbers of persons per household if good population estimates were to be made.	verb	5
988	1	In the UK we seem to be lagging well behind the USA in the construction of databases on hazardous sites and especially hazard events suchas those involving toxic releases.	verb	7
989	1	In the UK we seem to be lagging well behind the USA in the construction of databases on hazardous sites and especially hazard events suchas those involving toxic releases.	verb	14
990	1	In the UK we seem to be lagging well behind the USA in the construction of databases on hazardous sites and especially hazard events suchas those involving toxic releases.	verb	28
