	label	sentence	pos	v_index
453	1	If the person in default fails to comply with an abatement notice the local authority is obliged to make a complaint to the magistrates.	verb	16
454	1	The council argued that a landlord,  particularly one suchas a local authority,  can not realistically be expected to have a system of inspection of all its premises and in practice is entitled to depend upon notification by its tenants.	verb	31
455	1	Ulster,  the provincial champions,  may well >fancy their >chances on November 21,  but Leinster look certain to face an uphill struggle eventhough the tourists have rested 13 of the team that beat Wales.	verb	19
456	1	Leinster will be hard pushed to keep the score within the respectable margins of defeat set by their predecessors.	verb	12
457	1	In 1964 the All Blacks defeated Leinster 11-5,  they won 17-8 in 1972 and scraped home 8-3 in 1974.	verb	14
458	1	Leinster have been undermined by their failure to secure prestige fixtures since the mid-Seventies.	verb	10
459	1	The tourists will field four backs aged 21 or under.	verb	1
460	1	Fortunately,  Leinster 's front five,  which includes the experienced tight-head prop Des Fitzgerald,  looks up to the task of scrummaging against the All Blacks.	verb	10
461	1	All Blacks:  M Ridge;  J Timu,  B McCahill,  W Little,  V Tuigamala;  F Botica,  B Deans;  G Purvis,  W Gatland,  S McDowell,  I Jones,  G Whetton ( capt ),  A Whetton,  K Schuler,  Z Brooke.	verb	27
462	1	I WRITE inresponseto Judith Raymont ( November 16 ) who wrote of the cartoon Men—  A User 's Guide,  ‘ It is either insulting to men and should not be endorsed by publication,  or it is witty and amusing,  in which case we,  as women,  have no right to complain about equivalent portrayals of female stereotypes. ’	verb	30
463	1	In an ideal world,  there would be no need for either,  butfor now I would rather see the frustration expressed in these light-hearted >terms than in the sort of hating bitterness that has given feminism such a bad name.	verb	22
464	1	In an ideal world,  there would be no need for either,  butfor now I would rather see the frustration expressed in these light-hearted >terms than in the sort of hating bitterness that has given feminism such a bad name.	verb	30
465	1	OLDHAM Athletic,  who had never beaten a First Division side since they dropped into the Second Division in 1923,  made up for 66 years of not altogether patient waiting with a pulsating victory over the League champions Arsenal at Boundary Park last night.	verb	31
466	1	No supporter of the Latics dared dream it,  but suddenly the improbable was a throbbing,  joyous reality.	verb	14
467	1	Two goals from the irrepressible Andy Ritchie,  his 13th and 14th this season,  and a third by the 20-year-old midfield player Nick Henry,  and Arsenal were sunk with only the trace of a last-minute goal by Quinn.	verb	26
468	1	Two goals from the irrepressible Andy Ritchie,  his 13th and 14th this season,  and a third by the 20-year-old midfield player Nick Henry,  and Arsenal were sunk with only the trace of a last-minute goal by Quinn.	verb	30
469	1	Despite many and varied flurries of activity in the first 40 minutes,  Arsenal seemed reasonably secure if not inspired.	verb	4
470	1	They held their line and competed hard in midfield,  damping down Oldham 's initial verve and preparing themselves for more of the same in the second half.	verb	9
471	1	The predatory Ritchie chested the ball down and hammered a volley past Lukic.	verb	1
472	1	A neat step-over by Rocastle sent Thomas hurtling in on goal but Rhodes moved sharply off his line to smother the shot.	verb	19
473	1	Holden 's 64th-minute free-kick clattered the wall and the ball fell to Henry,  who drilled a low shot from morethan 30 yards inside Lukic 's right-hand post.	verb	4
474	1	Holden 's 64th-minute free-kick clattered the wall and the ball fell to Henry,  who drilled a low shot from morethan 30 yards inside Lukic 's right-hand post.	verb	14
475	1	Arsenal were stitched and stuffed,  with no question of a fluke.	verb	2
476	1	Arsenal were stitched and stuffed,  with no question of a fluke.	verb	4
477	1	Not for the first time this season their defence had been found wanting and Oldham exploited the weaknesses to the full,  owing a special debt to the inspiration and tireless running of Henry and Milligan.	verb	8
478	1	Not for the first time this season their defence had been found wanting and Oldham exploited the weaknesses to the full,  owing a special debt to the inspiration and tireless running of Henry and Milligan.	verb	15
479	1	He took it on the chin.	verb	5
480	1	We rattled them from the first minute and did n't give them any breathing space.	verb	1
481	1	Prototyping is crucial to systems development,  argues Ian Richards Tailored to fit.	verb	9
482	1	He finds out what the needs of the business are,  and prescribes the cure.	verb	11
483	1	‘ Oh,  this will be of great help in ordering raw materials,  but sometimes we get part deliveries,  could we have an extra facility to deal with those?	verb	23
484	1	The analyst is then forced on the defensive,  explaining why new features can not be included because they are technically difficult or prohibitively expensive.	verb	22
485	1	If you should stroll into a pub and meet an analyst and a user talking about work,  and you can not tell one from the other,  they have probably developed a successful system together.	verb	31
486	1	Container group Tiphook yesterday said it was still confident of winning its joint £643million bid for Sea Containers eventhough the battle has swung towards James Sherwood 's ferries-to-trailers combine.	verb	22
487	1	The offer from the Anglo-Swedish consortium formed by Tiphook and Stena AB is the subject of an appeal in the Bermudan courts which is aimed at overturning an earlier ruling allowing SeaCo to proceed with its ‘ poison pill ’ defence.	verb	40
488	1	Alternatively,  it may be able to muster enough support from SeaCo shareholders to halt the current disposal of assets by Mr Sherwood for its bid with Stena to be fully considered.	verb	6
489	1	Avon treads warily.	verb	1
490	1	Avon treads warily.	verb	2
491	1	IN December,  1943,  the men working feverishly to create the first American atomic bomb sent a team of ‘ spooks ’ to Naples.	verb	6
492	1	Amaldi dodged the American invitation,  perhaps because ( with Rome liberated ) Fermi 's mantle in physics had fallen on his young shoulders and there were younger minds to teach.	verb	14
493	1	He wore that mantle well at Rome University until his retirement in 1978.	verb	3
494	1	He then ordered a car to call for him the next morning for a similar occasion and was felled by a stroke while waiting for the lift.	verb	18
495	1	Amaldi astounded his group in October 1934 with his discovery that by slowing down,  ratherthan accelerating,  neutrons,  he could provoke intense nuclear reactions.	verb	1
496	1	It has employed a dual strategy to achieve these two objectives.	verb	2
497	1	First,  a comprehensive civil disobedience campaign was begun by which people severed,  or minimised,  all the contact points by which they were bound to the Israeli occupation authority.	verb	5
498	1	First,  a comprehensive civil disobedience campaign was begun by which people severed,  or minimised,  all the contact points by which they were bound to the Israeli occupation authority.	verb	11
499	1	First,  a comprehensive civil disobedience campaign was begun by which people severed,  or minimised,  all the contact points by which they were bound to the Israeli occupation authority.	verb	22
500	1	Some headway was made in expanding self-sufficiency,  whether through utilising more land for agriculture,  developing home economies,  or encouraging local manufacturers and products.	verb	1
501	1	Villages and refugee camps were thus being developed into ‘ liberated ’ or ‘ independent ’ areas,  if not militarily,  then atleast psychologically,  politically and infrastructurally.	verb	10
502	1	Bloody clashes would occur whenever armoured units raided these villages,  storming through makeshift defensive road blocks and responding to rocks being thrown with live bullets and tear gas;  but no sooner would these army units be gone than authority would revert to the village residents.	verb	1
503	1	The structure of the developing national authority has been both diffuse enough to prevent it from being destroyed by any one single sweep of arrests ( there have been morethan 50,000 arrests since the Intifada 's outbreak ),  and coherent enough to allow for the existence of a unified resistance strategy.	verb	1
504	1	The structure of the developing national authority has been both diffuse enough to prevent it from being destroyed by any one single sweep of arrests ( there have been morethan 50,000 arrests since the Intifada 's outbreak ),  and coherent enough to allow for the existence of a unified resistance strategy.	verb	17
505	1	A high level of mobility in the structure allows for continuous interchange of roles and ideas,  and retains for the Unified National Command the closeness to grass roots that is required to make it truly reflect people 's wishes and sentiments.	verb	4
506	1	A high level of mobility in the structure allows for continuous interchange of roles and ideas,  and retains for the Unified National Command the closeness to grass roots that is required to make it truly reflect people 's wishes and sentiments.	verb	24
507	1	A high level of mobility in the structure allows for continuous interchange of roles and ideas,  and retains for the Unified National Command the closeness to grass roots that is required to make it truly reflect people 's wishes and sentiments.	verb	26
508	1	THIS expanded network of popular committees and institutions making up the Unified leadership is infused by tens of thousands of activists who belong to,  or identify with,  the different factions of the PLO.	verb	14
509	1	Thrusts of resistance ( mass demonstrations,  resignations,  tax rebellions,  etc ) would come in crests.	verb	0
510	1	Thrusts of resistance ( mass demonstrations,  resignations,  tax rebellions,  etc ) would come in crests.	verb	2
511	1	Thrusts of resistance ( mass demonstrations,  resignations,  tax rebellions,  etc ) would come in crests.	verb	14
512	1	But the relation is complex,  not directional.	verb	6
513	1	Harsh measures—  putting an entire community under an absolute curfew for a continuous lengthy period of time,  demolishing homes,  uprooting olive or citrus trees,  physical intimidation and terror tactics employed by raiding army units,  shooting,  killing,  cutting off water or electricity supplies and telephone links to villages or towns,  mass arrests,  intimidatory interrogation techniques—  can either create a temporary lull or activate an eruption.	verb	63
514	1	It is asif it is walking through a minefield.	verb	8
515	1	The wave like pattern of the Intifada,  its pains and sufferings,  are all reminiscent of the process of birth.	verb	10
516	1	The wave like pattern of the Intifada,  its pains and sufferings,  are all reminiscent of the process of birth.	verb	13
517	1	The wave like pattern of the Intifada,  its pains and sufferings,  are all reminiscent of the process of birth.	verb	16
518	1	The Intifada is the midwife of freedom.	verb	4
519	1	Through it,  Palestinians are struggling on a daily basis to shake off Israel 's authority and to construct their own.	verb	17
520	1	The struggle reflects a revolution in mass consciousness,  by which people have come to realise that ideas and aspirations must be embodied in manifest acts if reality is to be changed.	verb	7
521	1	The masses are being engaged in the craft of masonry.	verb	7
522	1	The Declaration of Independence issued by the Palestine National Council ( PNC ) on November 15 last year constitutes a major landmark along this road.	verb	21
523	1	This has been a constant theme of Intifada policy:  that we wish to build ( Palestine ),  not to destroy ( Israel );  that we wish to achieve freedom ( for our people ),  not to deprive others ( Israelis ) of it;  that we wish to protect and save lives ( ours ),  not to endanger the lives of others ( Israelis ).	verb	19
524	1	We wish to be unharmed,  in our own state.	verb	4
525	1	If the PNC Declaration of Independence constituted a major landmark in this process,  the time has come to embark on another major step,  that of declaring the setting up of a state or government structure.	verb	18
526	1	Second,  it would consolidate the image and essence of the Intifada as a constructive,  not a destructive,  force.	verb	3
527	1	Naturally,  to embark on such a step is not necessarily to succeed immediately in realising it.	verb	2
528	1	It will be a further challenge to Israel 's occupation,  conceived in the image of earlier challenges of the Intifada.	verb	10
529	1	But it will also be a challenge to us,  Palestinians,  summoning us to work more energetically towards the idea 's fulfilment.	verb	10
530	1	It would be a natural extension of the Intifada 's dual strategy towards disengagement from Israel,  and the corresponding process of state building.	verb	5
531	1	It would further naturalise and legitimise the evolving skeletal form of Palestinian independence.	verb	3
532	1	It would further naturalise and legitimise the evolving skeletal form of Palestinian independence.	verb	8
533	1	It would maximise civilian tactics of resistance and defuse the natural potential for violence,  containing and eventually eliminating the marginal but intrusive phenomenon of collaborator activation by Israeli security authorities and collaborator execution by local Palestinians.	verb	19
534	1	Arresting or deporting the tens of thousands of Palestinian professionals who would be employed in perfectly apolitical,  harmless and humanitarian jobs can only further isolate the Israeli Government.	verb	24
535	1	In the meantime,  we have the capacity to bring coherence and organisation to a whole range of activities,  further consolidating the institutional linkage between the people in the occupied state and the PLO leadership.	verb	22
536	1	A pyramid administrative structure,  establishing links from popular committees in villages right upto the Executive Committee of the PLO ( in its capacity as a Cabinet ),  can be established.	verb	1
537	1	During the Intifada the people have been engaged in building the side walls.	verb	7
538	1	It would add another necessary touch in the process of creating a Palestinian home.	verb	5
539	1	‘ The Palestinian national movement inside and outside the occupied territories is an organic whole ’ PHOTOGRAPH:  DAVID SILLITOE	verb	13
540	1	GEORGE Tyson is not a gambling man nor does he take unnecessary risks.	verb	5
541	1	Until one morning in June 1988 when George Tyson turned on the radio to hear a small,  investment business called Barlow Clowes had collapsed.	verb	23
542	1	Pursuing legal action would have cost them money they did n't have ( unless it meant selling their house which was not an option ) but doing nothing left them with the feeling that justice was n't being done.	verb	0
543	1	So they compromised and gave £100 to the Barlow Clowes Investors Group which was formed last July to represent the investors ' interests and co-ordinate the fight for compensation.	verb	26
544	1	What little money has been recovered remains the subject of a legal tussle in the courts which may yet take months to resolve.	verb	12
545	1	The boy and the dog skirted round opposite sides of the puddle,  the boy,  a light,  tall fourteen-year-old,  labouring in wellington boots too large for him,  and the dog,  a three-year-old Labrador bitch,  picking her way reluctantly,  with frequent pauses,  asif her paws hurt.	verb	18
546	1	‘ Way you go,  Patty, ’ he said softly,  and the dog was off,  hurling herself along the embankment,  all paws and flying ears,  after a rabbit who had been sitting in a patch of sun but disappeared with contemptuous ease as she came close.	verb	14
547	1	‘ Way you go,  Patty, ’ he said softly,  and the dog was off,  hurling herself along the embankment,  all paws and flying ears,  after a rabbit who had been sitting in a patch of sun but disappeared with contemptuous ease as she came close.	verb	22
548	1	‘ Way you go,  Patty, ’ he said softly,  and the dog was off,  hurling herself along the embankment,  all paws and flying ears,  after a rabbit who had been sitting in a patch of sun but disappeared with contemptuous ease as she came close.	verb	39
549	1	The boy had been told unequivocally not to let her off the lead—  the riding-school only used the land by grace of its owner and it was a shooting estate—  but he hated keeping the dog straining at the lead and knew that she would always come to his call.	verb	29
550	1	Probably a squirrel,  he decided,  and slithered down the side of the embankment to join her,  scolding as he went.	verb	6
551	1	He saw a leg,  uncomfortably wedged between sapling trees,  swollen grotesquely,  and gazed at it,  stupidly,  wondering if it was plastic.	verb	12
552	1	As his eyes focused he realized he was looking at a hideously swollen human body,  and just then,  as the light breeze shifted,  he caught the turning odour of decay.	verb	26
553	1	She had known him since he was a very small five-year-old,  perched like a mosquito on one of the placid beginners ' ponies,  so she told the class to carry on walking their ponies while she came to him.	verb	11
554	1	She had known him since he was a very small five-year-old,  perched like a mosquito on one of the placid beginners ' ponies,  so she told the class to carry on walking their ponies while she came to him.	verb	14
555	1	He scrubbed at his face with the handkerchief she offered and gulped for air.	verb	11
556	1	The boy thought longingly of his mother,  but managed to help Miss Williams describe the location of the body to a startled local station sergeant and to drink a cup of sweet milky tea without being sick.	verb	24
557	1	He watched his aunt and Miss Williams wordlessly consult eachother,  but knew his aunt would do as she was told;  successful solicitor though she was,  she was ten years younger than Miss Williams and,  as she complained,  totally intimidated by her as she had not been by anyone since her late headmistress.	verb	21
558	1	Miss Williams took him to meet the police Land Rover at the stable gate,  a bone-thin,  wiry woman in her late fifties,  her expression sufficiently forbidding to prevent the parents,  edging cars through the gate to collect children from the ten o'clock ride,  from asking any questions.	verb	16
559	1	Miss Williams took him to meet the police Land Rover at the stable gate,  a bone-thin,  wiry woman in her late fifties,  her expression sufficiently forbidding to prevent the parents,  edging cars through the gate to collect children from the ten o'clock ride,  from asking any questions.	verb	30
560	1	Jamie,  through a renewed queasiness,  just observed that the police driver was instantly reduced to half his age by Miss Williams 's greeting.	verb	4
561	1	The CID sergeant thanked her gravely and went to stand beside Jamie who was peering down the embankment,  looking pinched.	verb	2
562	1	She took out a handkerchief and mopped her eyes.	verb	6
563	1	‘ He 'll perhaps not do it again, ’ the sergeant murmured,  and received the look that Miss Williams habitually bent on a child who was riding carelessly.	verb	20
564	1	‘ A few days, ’ the sergeant said,  grimly.	verb	6
565	1	The voice at the other end was plainly over-excited and it took him a minute to disentangle what he was being told.	verb	16
566	1	He paused,  reminding McLeish irresistibly of a Labrador wondering how best to approach an acquaintance.	verb	7
567	1	He paused,  reminding McLeish irresistibly of a Labrador wondering how best to approach an acquaintance.	verb	14
568	1	McLeish thanked him gravely,  feeling,  as he often did with the Wilsons,  that he was being enveloped in a large feather eiderdown,  and,  made restless by the call,  went down the corridor to where he knew Catherine Crane was also in,  getting her office in order.	verb	16
569	1	McLeish thanked him gravely,  feeling,  as he often did with the Wilsons,  that he was being enveloped in a large feather eiderdown,  and,  made restless by the call,  went down the corridor to where he knew Catherine Crane was also in,  getting her office in order.	verb	21
570	1	She let go of the cabinet,  coughing in the dust of ages that appeared to be lurking behind it,  and smiled back at him as the February sun shone through the small window behind her,  throwing into sharp relief the patches on the wall where her predecessor had hung posters,  and the ingrained dirt on the flaking paintwork round the mean,  narrow,  metal window.	verb	16
571	1	She let go of the cabinet,  coughing in the dust of ages that appeared to be lurking behind it,  and smiled back at him as the February sun shone through the small window behind her,  throwing into sharp relief the patches on the wall where her predecessor had hung posters,  and the ingrained dirt on the flaking paintwork round the mean,  narrow,  metal window.	verb	40
572	1	Without Angela Morgan,  atleast two major clients were in danger of not getting the assiduous service they were paying for,  and it would be well worth trying to see if one of them,  whom he knew to be a fellow refugee from family life at the weekends,  could be found.	verb	14
573	1	He was in luck,  and fixed to meet Andy Barton at Brazzo 's where Yeo Davis had a table permanently booked.	verb	5
574	1	He had to admit that this particular client hardly added to the general decorative smartness of the place.	verb	14
575	1	‘ They make a huge margin on a smaller turnover,  Andy,  outof punters like us. ’	verb	9
576	1	‘ They make a huge margin on a smaller turnover,  Andy,  outof punters like us. ’	verb	12
577	1	Barton worked a sixteen-hour day,  which began with careful,  detailed consideration of the trading figures and key ratios for every one of his forty-three major shops and the output of both factories,  and continued,  usually by helicopter,  with a detailed aerial survey of a particular area as the quick way of identifying new sites,  interspersed with unheralded descents on the manager of any shop he took a fancy to visit.	verb	54
578	1	Peter Yeo,  who had known this particular juggernaut since he had his first small factory and two stores and dirt under his fingernails from shifting packing-cases personally,  was not fazed by the question.	verb	7
579	1	I 'm up to speed with Huerter,  ofcourse,  but is your planning application in Leicester allright? ’	verb	4
580	1	Plenty of housing if those stupid farts at the council got round to repairing it and stopped their tenants tearing apart what they have got.	verb	6
581	1	Peter Yeo,  who had personally persuaded Barton of the presentational disadvantage of using words like ‘ darkies ’,  ‘ niggers ’ or ‘ wogs ’,  decided that ‘ immigrants ’ eventhough used in the manner of one invoking a curse,  was as good as he was going to get with this particular client.	verb	9
582	1	Peter Yeo,  who had personally persuaded Barton of the presentational disadvantage of using words like ‘ darkies ’,  ‘ niggers ’ or ‘ wogs ’,  decided that ‘ immigrants ’ eventhough used in the manner of one invoking a curse,  was as good as he was going to get with this particular client.	verb	39
583	1	‘ She 's doing a good job on sorting this Huerter thing,  too.	verb	8
584	1	Bloody ridiculous them blokes at the DTI pushing assistance for Huerter.	verb	0
585	1	I voted for this government because they said they were n't going to go in for that sort of rubbish.	verb	19
586	1	Peter Yeo winced inwardly,  but he was not going to tell Andy Barton that Angela was missing,  or express any of his reservations about how much influence Angela could bring to bear.	verb	2
587	1	Peter Yeo winced inwardly,  but he was not going to tell Andy Barton that Angela was missing,  or express any of his reservations about how much influence Angela could bring to bear.	verb	26
588	1	The rest of lunch passed in similar diversion,  interspersed with details of last week 's turnover which were never far from Barton 's mind,  whatever other distractions offered.	verb	7
589	1	The rest of lunch passed in similar diversion,  interspersed with details of last week 's turnover which were never far from Barton 's mind,  whatever other distractions offered.	verb	8
590	1	The rest of lunch passed in similar diversion,  interspersed with details of last week 's turnover which were never far from Barton 's mind,  whatever other distractions offered.	verb	15
591	1	She was frowning,  deep lines appearing between her eyebrows,  mouth drawn down at the edges sothat instead of a classically good-looking slim English Rose in her late twenties,  she looked faded,  years older than her real age,  and shrewish.	verb	23
592	1	She was frowning,  deep lines appearing between her eyebrows,  mouth drawn down at the edges sothat instead of a classically good-looking slim English Rose in her late twenties,  she looked faded,  years older than her real age,  and shrewish.	verb	30
593	1	Penelope,  however,  it had to be acknowledged,  had made no attempt to rise above the blow she had been dealt by finding a dazzling girl of her own age favoured over herself in her uncle 's will.	verb	23
594	1	Atleast,  Mrs Huntley thought hopefully,  she had stopped wondering,  unbecomingly and stridently,  how her uncle could have been fooled by Angela Morgan.	verb	9
595	1	Atleast,  Mrs Huntley thought hopefully,  she had stopped wondering,  unbecomingly and stridently,  how her uncle could have been fooled by Angela Morgan.	verb	11
