	label	sentence	pos	v_index
0	1	If he had taken his own rule seriously,  he would have found out that DRG has a very modest self-service canteen at its Bristol head office.	verb	18
1	1	Alongwith Sir James he found the US much more attractive,  taking over and breaking up some fairly hefty US corporations.	verb	17
2	1	He rejects charges that he was partly responsible for the ‘ casino atmosphere ’ that gripped US corporate life in the early 1980s.	verb	12
3	1	He rejects charges that he was partly responsible for the ‘ casino atmosphere ’ that gripped US corporate life in the early 1980s.	verb	15
4	1	In a takeover campaign that has already seen vitriolic language,  he responds to the charge that he is mounting the bid to enrich himself and his friends by saying:  ‘ Nobody could take that as a criticism—  this is an investor group.	verb	18
5	1	This clause has never yet been activated.	verb	6
6	1	The sharply reduced number of 16-18-year-olds will inevitably lead employers to bid up the wages of that age group to entice young people awayfrom education and into unskilled or semi- skilled jobs.	verb	29
7	1	The sharply reduced number of 16-18-year-olds will inevitably lead employers to bid up the wages of that age group to entice young people awayfrom education and into unskilled or semi- skilled jobs.	verb	30
8	1	Only then will two vitally important and complementary goals be achieved:  to improve Britain 's general educational and vocational competence,  and hence our productive capacity;  and to reduce our gross educational inequalities between the elite who receive a narrow education to a very high standard,  and the rest.	verb	18
9	1	Sir:  Labour does not need a commitment to proportional representation inorder to scoop most of the centre ground at the next general election.	verb	12
10	1	Sir:  If Labour is to suggest the setting up of a specialist labour court ( 30 September ),  then such a momentous change in the industrial relations system deserves more discussion,  and needs to be taken outof the hot-house of Labour Party conference politics.	verb	38
11	1	Second,  it would ensure that workers enjoyed positive rights under law and reduce the emphasis of union immunities.	verb	17
12	1	Labour law will always reflect the balance of power in society,  and a fully fledged labour court system will not remove class and fundamental employer-employee differences.	verb	4
13	1	Labour law will always reflect the balance of power in society,  and a fully fledged labour court system will not remove class and fundamental employer-employee differences.	verb	14
14	1	But it should be possible to create and enforce enough common rules to prevent the absurd see-sawing of industrial relations legislation we have seen since 1969.	verb	16
15	1	The supposedly jokey answers are illustrated by photographs of people sleeping outside covered by copies of The Independent:  they look like some of the hundreds of visitors who come to St Botolph s Crypt Centre for homeless people every day.	verb	33
16	1	Now,  it would appear from this article,  that this ideal is shattered and a -tiered Europe is on the cards.	verb	11
17	1	Now,  it would appear from this article,  that this ideal is shattered and a -tiered Europe is on the cards.	verb	14
18	1	This is a clear example of the extension of the Prevention of Terrorism Act where criteria for stopping,  questioning and searching are purely subjective to the official involved.	verb	7
19	1	This is a recipe for fear and anxiety.	verb	3
20	1	Montenegro 's sudden rehabilitation of Nicholas 's memory is a popular move.	verb	3
21	1	For a man whom Rebecca West,  a contemporary Balkan observer,  called ‘ repulsive ’ and ‘ treacherous ’ for deserting his Serbian son-in-law,  King Alexander,  in the First World War,  it is a tinted view of history.	verb	12
22	1	This furthered his long-term ambition to rule a large ‘ south Slav ’ kingdom when the Ottoman Empire finally collapsed.	verb	19
23	1	These influences laid the foundations for the blend of the naive and the sophisticated which is the hallmark of Thomson 's maturity.	verb	17
24	1	In Four Saints Thomson 's informality was given free reign since he first of all improvised the music at the piano then,  when it stuck,  wrote it down to a figured bass.	verb	30
25	1	He said:  ‘ I had wondered whether a piece so drenched in Anglican chant ( running from Gilbert and Sullivan to Morning Prayer and back ) could rise and sail. ’	verb	29
26	1	But the resulting mixture of hymns,  folksy tunes and recitatives—  at times of intoxicating banality—  was a sensation.	verb	13
27	1	Just as Thomson transferred Stein 's literary abstraction to music,  so these portraits unusually employ the painter 's technique of drawing the sitter from life:  an ideal combination of Thomson 's habit of immediate response with an actual subject.	verb	22
28	1	The results are terse and sharply etched,  like the best line drawings.	verb	3
29	1	The results are terse and sharply etched,  like the best line drawings.	verb	6
30	1	He started by writing occasional articles but in 1939 he wrote The State of Music,  a trenchant and provocative assessment of the machinery of the musical profession at the time.	verb	19
31	1	He started by writing occasional articles but in 1939 he wrote The State of Music,  a trenchant and provocative assessment of the machinery of the musical profession at the time.	verb	22
32	1	As both composer and critic he touched both sides of the coin:  A climate of receptivity is what the artist most desires.	verb	6
33	1	He fearlessly attacked convention,  which caused problems when he pitched into established reputations.	verb	9
34	1	It has become increasingly apparent that Thomson belonged to the American experimental tradition.	verb	7
35	1	There are Stein settings,  suchas ‘ Portrait of FB ’,  but also cycles suchas Five Songs from William Blake,  Prayers and Praises and a cantata based on poems by Edward Lear.	verb	6
36	1	There are Stein settings,  suchas ‘ Portrait of FB ’,  but also cycles suchas Five Songs from William Blake,  Prayers and Praises and a cantata based on poems by Edward Lear.	verb	12
37	1	From there,  like a buzzard in its eyrie,  he would make forays round the US and abroad inspiteof his advanced age.	verb	4
38	1	From there,  like a buzzard in its eyrie,  he would make forays round the US and abroad inspiteof his advanced age.	verb	7
39	1	From there,  like a buzzard in its eyrie,  he would make forays round the US and abroad inspiteof his advanced age.	verb	11
40	1	He seemed a genial and indestructible landmark in the history of American music,  inspiteof defective hearing which had bothered him since the late Seventies.	verb	5
41	1	He seemed a genial and indestructible landmark in the history of American music,  inspiteof defective hearing which had bothered him since the late Seventies.	verb	6
42	1	He did not loosen his links with the athletes when projected upwards into the Presidency.	verb	10
43	1	As a rich,  forceful young man,  Keller had been earmarked as a likely future president,  even before Mullegg was killed in an aircrash in 1958.	verb	9
44	1	Keller was made a Steward of Henley Royal Regatta in 1976,  a time when the proliferation of new -lane,  still-water courses around the world,  which had emerged under his guidance,  seemed a threat to the regatta founded in 1829.	verb	18
45	1	But it was the spirit of Henley,  with huge crowds enjoying amateur sport,  presented with administrative finesse,  which Keller took as the yardstick for the international circuit.	verb	22
46	1	But it was the spirit of Henley,  with huge crowds enjoying amateur sport,  presented with administrative finesse,  which Keller took as the yardstick for the international circuit.	verb	26
47	1	He loved the place and he returned every year to play an often small part as umpire of races between undistinguished clubs far below the Olympic standard he was obliged to administer.	verb	16
48	1	He loved the place and he returned every year to play an often small part as umpire of races between undistinguished clubs far below the Olympic standard he was obliged to administer.	verb	26
49	1	During his term as President of FISA he gradually reduced his role in Eduard Keller Ltd and used the company offices to provide a world headquarters for rowing.	verb	25
50	1	The sport is now obliged to find income from the more normal sources of television and sponsorship,  to replace his largely unacknowledged private patronage.	verb	4
51	1	The final task he set himself for his Presidency,  which was due to end next year,  was to weed outof the Regatta calendar all the rowing courses which could be made unfair by the wind.	verb	18
52	1	The Labour Party Conference:  Policy review throws a spanner in the Whitehall machinery	verb	8
53	1	AN INCOMING Labour government would turn large areas of Whitehall upsidedown—  but the party 's policy review barely considers the implications of its plans for restructuring government departments.	verb	10
54	1	The only department which explicitly escapes unscathed is the one which Conservatives would most like to abolish:  the Department of Energy.	verb	5
55	1	Nor does it contemplate the knock-on consequences for Labour ministers of attempting to implement their programme while rebuilding the governmental machine.	verb	3
56	1	Nor does it contemplate the knock-on consequences for Labour ministers of attempting to implement their programme while rebuilding the governmental machine.	verb	20
57	1	The ‘ medium term industrial strategy ’ which would form the centrepiece of Labour 's economic policy would,  accordingto the Productive and Competitive Economy review group,  be ‘ administered by a transformed Department of Trade and Industry ’.	verb	11
58	1	That approach would seek to knock out a keystone of Civil Service tradition.	verb	8
59	1	But while the DTI would override the Treasury,  a new ‘ powerful Department of Consumer Affairs ’ would antagonise the DTI.	verb	5
60	1	But while the DTI would override the Treasury,  a new ‘ powerful Department of Consumer Affairs ’ would antagonise the DTI.	verb	18
61	1	The concept of a minister having Cabinet rank—  and therefore implicitly not being a member of the Cabinet proper—  crops up again on environment.	verb	14
62	1	In some cases Labour 's quangos merge existing ones,  or replace well-established bodies.	verb	12
63	1	It would also be necessary ‘ to smash the decrepit,  effete constitution that allows a minority to capture power,  and then use it ruthlessly in the interests of the privileged few ’.	verb	7
64	1	It would also be necessary ‘ to smash the decrepit,  effete constitution that allows a minority to capture power,  and then use it ruthlessly in the interests of the privileged few ’.	verb	10
65	1	Mr Cook argued that 10 years of Thatcherism had been forced on most people,  who had never voted Conservative,  and that many of those who opposed PR in the Labour Party wanted to use the same undemocratic power ‘ to ram socialism down the throats of a majority who did n't vote for it ’.	verb	44
66	1	Labour would be acquiescing in a ‘ democratic outrage ’ if it continued arguing that,  because the Conservatives had got away with being undemocratic for so long,  it was now Labour 's turn.	verb	3
67	1	Mr Cook also countered the argument that PR would build in a pull towards the centre ground,  preventing Labour from implementing a radical programme.	verb	22
68	1	‘ I can not honestly see that a system which would require us to compromise the morning after the election is really so morally inferior to a system which has already obliged us to compromise our policies two years before polling day. ’	verb	31
69	1	Mr Livingstone said he was against pacts,  but 10 years of Thatcherism had demonstrated the dangers of giving power to elites.	verb	18
70	1	Mr Kinnock said it was wrong to propose a fundamental change in the voting system for a short-term tactical vote to get rid of the Thatcher Government.	verb	18
71	1	Mr Kinnock intends to reinforce his conviction that Labour is in a position to win in his keynote speech tomorrow.	verb	6
72	1	Party organisers want the conference to show that the party is united as never before,  leaving Mr Kinnock free for the first time to sell the policy package to voters without worrying about splits.	verb	33
73	1	PUB ROCK / Pint-sized rock ‘ n ’ rollers:  Jim White selects the best of the London pub venues and gigs in the weeks ahead	verb	3
74	1	PUB ROCK / Pint-sized rock ‘ n ’ rollers:  Jim White selects the best of the London pub venues and gigs in the weeks ahead	verb	8
75	1	Another rule of thumb is that if the act is obliged to rest their microphone stand and amplifiers on beer crates insteadof the stage,  it will be a good evening.	verb	10
76	1	WHO TO WATCH While the best that chart music can manage in the way of band names is Black Box,  the pub circuit has always been ripe with imaginative handles.	verb	22
77	1	WHO TO WATCH While the best that chart music can manage in the way of band names is Black Box,  the pub circuit has always been ripe with imaginative handles.	verb	29
78	1	PLAYING THIS WEEK TONIGHT Bop Brothers Blues Band The plethora of litigation surrounding Blues Brothers lookalikes almost matches that attached to the release of Wired,  the unofficial biography of the original brother,  John Belushi.	verb	9
79	1	Well Loaded Much -about guitar rockers,  generally regarded as destined for the bigger stadia of life,  unless they self-destruct enroute.	verb	1
80	1	Well Loaded Much -about guitar rockers,  generally regarded as destined for the bigger stadia of life,  unless they self-destruct enroute.	verb	13
81	1	Well Loaded Much -about guitar rockers,  generally regarded as destined for the bigger stadia of life,  unless they self-destruct enroute.	verb	18
82	1	Primal Scream Not a name which would lead you to expect -absorbed acoustic doodlings.	verb	13
83	1	Which is just as well,  because long-haired rock is what you will get.	verb	6
84	1	FRIDAY Dr & The Medics Silly hippies in Roy Wood cast-off costumes do n't sound like the most appetising evening out,  and their brief foray into the charts was a considerable embarrassment,  but the good Dr 's tongue is in the right place ( in his cheek ) and a jolly time is guaranteed.	verb	18
85	1	FRIDAY Dr & The Medics Silly hippies in Roy Wood cast-off costumes do n't sound like the most appetising evening out,  and their brief foray into the charts was a considerable embarrassment,  but the good Dr 's tongue is in the right place ( in his cheek ) and a jolly time is guaranteed.	verb	24
86	1	MON 9 OCT Steve Marriott & Mickey Hutton In among those on their way up,  and those who will never go anywhere,  the pub rock circuit plays host to those who were once really something.	verb	25
87	1	Small but perfectly formed for pub rocking ( ie sweaty and restricted view from all but the front three rows ).	verb	9
88	1	Not sure of the music policy,  but the name sounds like the ingredients of a takeaway from a less salubrious Chinese.	verb	19
89	1	Not sure of the music policy,  but the name sounds like the ingredients of a takeaway from a less salubrious Chinese.	verb	20
90	1	Dublin Castle 94 Parkway,  NW1 ( 485 1773 ) Beloved of Camden 's grunge rock enthusiasts,  a temple to R'n'B,  complete with priceless memorabilia decorating the brown-painted ( or nicotine-stained ) walls.	verb	17
91	1	Half Moon Putney 93 Lower Richmond Rd,  SW15 ( 788 2387 ) Better known for its jazz,  but a good,  wholesome venue for rock nonetheless.	verb	20
92	1	King 's Head,  Fulham 4 Fulham High St,  SW6 ( 736 1413 ) L -shaped room,  part corridor,  part bar,  part dance-floor,  with the stage in one corner,  ensuring restricted view from virtually everywhere.	verb	13
93	1	Perhaps the best atmosphere around,  with uninhibited dancing and whelping.	verb	6
94	1	New Pegasus 109 Green Lanes,  N16 ( 226 5930 ) Pub which has gone through several incarnations,  most recently known as Chas'n'Dave 's.	verb	16
95	1	The odd policy to put the stage in the middle of the room ratherthan at one end leads to a diminishing of the atmosphere ( the corners are seldom filled ).	verb	20
96	1	The odd policy to put the stage in the middle of the room ratherthan at one end leads to a diminishing of the atmosphere ( the corners are seldom filled ).	verb	23
97	1	The stains on the carpet have survived every name change.	verb	6
98	1	There are few things worse than being bludgeoned into reading a book you hate.	verb	7
99	1	They win their parents over with a rose -tinted vision of the world which is decidedly reassuring.	verb	8
100	1	They win their parents over with a rose -tinted vision of the world which is decidedly reassuring.	verb	16
101	1	The Ahlbergs have been accused of not facing upto the harsh realities of life,  of being too cosy and sweet,  but their latest picture book,  Bye Bye Baby,  published today,  breaks the mould.	verb	32
102	1	Curious subject matter for a children 's picture book,  you might think,  and hardly guaranteed to win the approval of the gimlet -eyed children 's book world.	verb	21
103	1	Curious subject matter for a children 's picture book,  you might think,  and hardly guaranteed to win the approval of the gimlet -eyed children 's book world.	verb	22
104	1	‘ Certainly if you bring a literal interpretation to the story,  it 's a minefield, ’ Allan Ahlberg says.	verb	14
105	1	The time-consuming nature of Janet 's part in the process,  combined with a bad back which prevents her spending more than a couple of hours at the drawing board every day,  means she can not keep up with her husband 's prolific output.	verb	2
106	1	Allan Ahlberg says:  ‘ In the past,  a lot of children 's books seemed to be the work of talented illustrators whose pictures looked brilliant framed in a gallery,  but when you tried to read the book,  there was nothing there,  because the words started as a coat-hanger to hang pictures on. ’	verb	24
107	1	Allan Ahlberg says:  ‘ In the past,  a lot of children 's books seemed to be the work of talented illustrators whose pictures looked brilliant framed in a gallery,  but when you tried to read the book,  there was nothing there,  because the words started as a coat-hanger to hang pictures on. ’	verb	47
108	1	The couple still maintain close links with local schools,  where they spend hours researching,  sketching and absorbing jokes.	verb	16
109	1	It 's a killing job.	verb	3
110	1	But people seem to think that stories are written to a prescription,  that you sit down and say,  you do n't want it to be sexist,  you do n't want it to be racist.	verb	11
111	1	Although they are a principled pair—  they once turned down the Smarties Award on moral grounds—  the Ahlbergs reject the notion of children 's author as moralist.	verb	15
112	1	The revolution the countryside needs:  Christian Wolmar says Britain is lagging behind in setting up ‘ telecottages ’	verb	10
113	1	This clever name,  with its neat evocation of new and old,  describes a concept which was developed in Sweden and is spreading to rural areas across the world.	verb	21
114	1	Mr Dobbs,  who is chairman of Telecottages UK,  warns possible users not to get bogged down with the technology:  ‘ The equipment is a tool to overcome what needs to be done.	verb	14
115	1	Mr Dobbs 's more unlikely allies are the Women 's Institutes.	verb	5
116	1	He is working on a scheme with the National Federation of WI to organise a competition to celebrate next year 's 75th anniversary by offering 10 telecottages as prizes for its 9,000 branches and he is hoping the WI will establish a pilot telecottage near its college in Denman,  Oxfordshire.	verb	32
117	1	Henning Albrechsten reckons that it takes three years for a telecottage to be able to function without subsidy.	verb	2
118	1	The village is a fantastic institution and they make people happier. ’	verb	4
119	1	But the villages are dying,  becoming suburbs or dormitories where few people work but many sleep.	verb	8
120	1	The abstract talk of commuting by rail or road being replaced by information technology finds a concrete expression in the idea of telecottages.	verb	16
121	1	Britain,  with its growing traffic problems,  seems an ideal place for the onset of this revolution.	verb	15
122	1	Despite Mr Dobbs 's tireless efforts,  this is another revolution which Britain is likely to be viewing from the sidelines.	verb	4
123	1	EACH new indignity in the heap visited on Welsh rugby seems worse than the last.	verb	6
124	1	The selectors knew they were playing with fire when they decided to arrange a couple of club fixtures and they have duly been consumed in a conflagration of their own making.	verb	17
125	1	The selectors knew they were playing with fire when they decided to arrange a couple of club fixtures and they have duly been consumed in a conflagration of their own making.	verb	23
126	1	The selectors knew they were playing with fire when they decided to arrange a couple of club fixtures and they have duly been consumed in a conflagration of their own making.	verb	26
127	1	On and off the field the national game of the Land of Song is in a discordant mess.	verb	16
128	1	Losing was one thing but to lose as spinelessly as the Welsh XV did to Bridgend on Saturday was to add insult to severely injured pride.	verb	8
129	1	Four of the absentees suffered the squirming discomfort of being among the Welsh squad.	verb	6
130	1	His plans in ruins,  he is now reduced,  Micawber like,  to hoping something will turn up before his players face the All Blacks in five short weeks.	verb	8
131	1	But another selector confided the truth that Wales should be giving club opposition a hammering—  and at half,  building on their win over Newbridge,  it looked asif they would.	verb	14
132	1	They had weathered Bridgend 's early fury,  conceding a try before coming back with some confidence to score three of their own.	verb	6
133	1	They had weathered Bridgend 's early fury,  conceding a try before coming back with some confidence to score three of their own.	verb	7
134	1	From the comparative opulence of 17-6 they then slipped into penury by conceding 18 unanswered points.	verb	10
135	1	Noone who was at the Brewery Field ( perhaps not even the selectors ) would give twopence for their ability to do so.	verb	16
136	1	Apartfrom Kevin Moseley 's steady supply from the line-out,  there was nothing much to commend in a Welsh forward effort which reverted to the very worst Eighties stereotype of static,  cumbersome donkeys only too willing to slow the game to walking pace.	verb	21
137	1	Apartfrom Kevin Moseley 's steady supply from the line-out,  there was nothing much to commend in a Welsh forward effort which reverted to the very worst Eighties stereotype of static,  cumbersome donkeys only too willing to slow the game to walking pace.	verb	31
138	1	‘ When the pressure comes on,  players revert to bad habits, ’ Ryan said.	verb	3
139	1	This was conveniently encapsulated in the first try.	verb	3
140	1	It was a magnificent fightback and such was Welsh distress that they never looked like preventing it.	verb	9
141	1	‘ We have taken a step backward, ’ Ryan said—  and on this sorry evidence it looks asif it will be backwards all the way when the Test takes place at Cardiff Arms Park on 4 November.	verb	13
142	1	The only redeeming feature of a goalless,  worthless event at Stamford Bridge was that it did not require a grant.	verb	2
143	1	Bobby Robson was there to assess World Cup candidates,  but nothing positive emerged from 90 minutes of scuffling that made one almost yearn for the more measured boredom of Rangers ' European Cup exit in Munich three days earlier.	verb	12
144	1	Television had postponed Manchester United 's scheduled visit to Anfield so it could be shown live on 22 December,  the longest night.	verb	2
145	1	London 's leading pair,  asif piqued by this,  turned 30 September into the longest afternoon.	verb	5
146	1	Why,  though,  could these supposed championship contenders not have tried to emulate the fine passing that had sprinkled the previous weekend 's Merseyside joust?	verb	17
147	1	Why,  though,  could these supposed championship contenders not have tried to emulate the fine passing that had sprinkled the previous weekend 's Merseyside joust?	verb	23
148	1	They ought to have pocketed three points in the first half but Tony Adams,  a more threatening centre-forward on his forays than the current Alan Smith,  missed the target with two headers and David Rocastle let Dave Beasant save a penalty,  much as the stretch keeper had done for Wimbledon in the 1988 FA Cup final.	verb	4
149	1	They ought to have pocketed three points in the first half but Tony Adams,  a more threatening centre-forward on his forays than the current Alan Smith,  missed the target with two headers and David Rocastle let Dave Beasant save a penalty,  much as the stretch keeper had done for Wimbledon in the 1988 FA Cup final.	verb	20
150	1	If so,  it will be a gamble,  because he flopped on his only previous international appearance in Saudi Arabia.	verb	9
151	1	Very kind,  but international players are supposed to be habitually influential,  and it was Hazard who in the second half,  with a few incisive passes,  gifts from the heavens on a day like this,  left a greater mark.	verb	28
152	1	They have also aroused Protestant anger against Dr Runcie,  at the same time as he has become involved in a row over his attack on the ‘ Pharisees ’ of British society.	verb	27
153	1	But in their prepared homilies the Pope and the Archbishop addressed quite different problems.	verb	10
