	label	sentence	pos	v_index
1290	1	Inrelationto the sentence stem ‘ A girl and her mother… ’,  girls often produce responses like ‘ often go through a bad patch for a year but once they learn to understand eachother,  become the best of friends ’ or ‘ can help eachother with their problems ’.	verb	22
1291	1	In contrast,  boys seem to have a firmer self-identity and a clearer ambition showing more insight inresponseto sentence stems suchas ‘ My main problem is… ’ and ‘ He/she felt proud that… ’.	verb	18
1292	1	The science boys seemed to possess few doubts or uncertainties,  they offered clear-cut answers.	verb	5
1293	1	Crisis in this context describes a period of intensive self-examination in which one 's beliefs and values are re-examined.	verb	9
1294	1	This condition is known as foreclosure.	verb	5
1295	1	Eventually these persons might have to face upto period of crisis,  of self-examination,  and so achieve ego-identity by route C. However,  foreclosure does offer an escape route and an individual might postpone indefinitely any real self-examination by clinging rigidly to his [ or her ] beliefs and values ( route D ).	verb	37
1296	1	Eventually these persons might have to face upto period of crisis,  of self-examination,  and so achieve ego-identity by route C. However,  foreclosure does offer an escape route and an individual might postpone indefinitely any real self-examination by clinging rigidly to his [ or her ] beliefs and values ( route D ).	verb	38
1297	1	Opting for science will permit and possibly reinforce emotional reticence.	verb	7
1298	1	Consequently,  very few girls at the foreclosure stage will enter science unless they receive considerable encouragement and a model to do so from their parents and their school.	verb	6
1299	1	They are at a stage when they are likely to be concerned with a variety of complex issues;  the meaning of life,  the existence of God,  ideologies,  their emerging sexuality,  their future career and life-style—  too often science is seen as being purely instrumental with nothing to contribute to these debates.	verb	47
1300	1	A large number of boys,  particularly at the foreclosure stage,  are initially attracted to science but there is a drift away throughout later adolescence as they undergo some crisis.	verb	8
1301	1	The preponderance of boys at the foreclosure stage will yield the rigid,  authoritarian attitudes often associated with scientists.	verb	6
1302	1	The few girls who enter science will not usually show these foreclosure characteristics.	verb	11
1303	1	More boys and girls will have reached the ego-identity achievement stage and a proportion of these will go into science.	verb	13
1304	1	It might make it easier for girls at the foreclosure stage to accept science so recruitment might increase.	verb	9
1305	1	Is it possible to change school science in this fashion and still preserve the essential character of science itself?	verb	15
1306	1	Clearly there would need to be some drastic pruning of content.	verb	8
1307	1	It is interesting to notice that the Association for Science Education ( 1979 ) policy statement in Britain and the proposals on school physics coming from the Institute for Science Education ( IPN ) in Kiel are advocating such changes.	verb	37
1308	1	The difference is that we are now offering a formal psychological model to suggest that if we want to reduce the current encapsulation of science,  if we want to recruit a different sort of student,  then certain curriculum changes are needed. 	verb	22
1309	1	Girls Into Science and Technology ( GIST ) was the first major schools-based project addressing problems of sex stereotyping at school,  and was an example of ‘ action research ’ in education;  the project simultaneously took action to improve girls ' achievement in science and technology and investigated the reasons for their under-achievement.	verb	14
1310	1	Pupils in action schools became markedly less stereotyped than pupils in control schools.	verb	0
1311	1	VISTA made science more girl friendly in two ways:  both boys and girls were offered an attractive image of a competent woman scientist,  and talks concentrated on social and industrial applications of science,  an element too often missing from science at school.	verb	16
1312	1	VISTA made science more girl friendly in two ways:  both boys and girls were offered an attractive image of a competent woman scientist,  and talks concentrated on social and industrial applications of science,  an element too often missing from science at school.	verb	34
1313	1	Atpresent the science curriculum is structured around physical science interests,  on which boys are keener ( how motor cars work,  atoms and molecules );  we were able to recommend that teaching build on the overlapping interests of the two sexes,  because girls aswellas boys want to know more about human biology and spectacular features of the environment ( animals in the jungle,  volcanoes and earthquakes,  acids and chemicals ).	verb	14
1314	1	These examples indicate some of the features of girl friendly science:  it builds on girls ' interests,  not just boys ';  it explicitly encourages girls to see themselves as potential scientists,  and it includes some of the social and human implications and applications of science.	verb	2
1315	1	For a more girl friendly science,  it seems vital that teachers should come to see that when all the masculine packaging,  evident in textbooks and resources aswellas teachers ' and boys ' behaviour in the classroom,  is removed,  girls can be very enthusiastic about science.  [… ]	verb	20
1316	1	First,  the pupils,  teachers and practitioners of science are overwhelmingly male intermsof numbers;  second,  school science is packaged and presented to appeal to boys,  not girls;  third,  classroom behaviours and interaction operate to reconstruct science as a male activity,  and finally it has been suggested that ‘ scientific ’ thinking embodies an intrinsically masculine world view.	verb	33
1317	1	The fourth point,  the idea that science is intrinsically masculine,  can be sustained only by clinging to an irredeemably narrow conception of science and scientific thinking.	verb	19
1318	1	This chapter is an account of the way they perceived attempts to develop integrated provision for under fives and the barriers in attitudes and systems which were encountered.	verb	20
1319	1	This chapter is an account of the way they perceived attempts to develop integrated provision for under fives and the barriers in attitudes and systems which were encountered.	verb	22
1320	1	The fourth section examines the formidable barriers that were posed by reorganisation of social services,  local authority cuts and the demise of the Inner London Education Authority.	verb	5
1321	1	Some integrated services emerged in the early 1980s—  one playscheme was developed through a parent 's initiative,  and an integrated adventure playground was established by a voluntary organisation.	verb	3
1322	1	These ideas were informed by a paper which had already been produced by an active member of the local Mencap group,  who had previously tried to generate the debate within the Community Health Service through the Mencap committee. 	verb	26
1323	1	Over against the German army or the Vichy government,  where social generality ruled,  as it does in all machines of state,  the Resistance offered the rare phenomenon of historical action which remained personal.	verb	18
1324	1	The Resistance was a unique experience for them,  and they wanted to preserve its experience in the new French politics because this experience broke awayfrom the famous dilemma of being and doing,  which confronts all intellectuals in the face of action….	verb	33
1325	1	It is only too obvious that this balance between action and personal life was intimately bound up with the conditions of clandestine action and could not survive it.	verb	14
1326	1	And in this sense it must be said that the Resistance experience,  by making us believe that politics is a relationship between man and man or between consciousnesses,  fostered our illusions of 1939 and masked the truth of the incredible power of history which the Occupation taught us in another connection.	verb	28
1327	1	Accordingly,  he attempted to shift Marxism awayfrom orthodox theories of an absolute determinism towards the primacy of a concept of ‘ History ’ which,  while still a totality as it had been for Lukács,  a process with a determinate meaning and end,  could also include a concept of human agency and thus articulate the individual with the social,  freedom with determinism.	verb	52
1328	1	Today,  Sartre 's voluntarism is to some extent returning to favour as the result of a desire to retrieve the categories of agency and the subject,  which goes together with the wish to get outof the apparently totalizing systems of Adorno,  Althusser or Foucault.	verb	18
1329	1	Sartre 's stress on the role of the subject also finds approval because many of those nolonger prepared to argue for a general theory of history as the progress of a single narrative of struggle,  have begun to argue instead for a return of its correlative,  the subject,  almost asif it was the next best thing in the absence of history itself.	verb	32
1330	1	Sartre considered that orthodox dialectical materialism takes the easy way out by merely eliminating the first infavourof the second,  making man a passive product entirely determined by economic circumstances.	verb	13
1331	1	Sartre considered that orthodox dialectical materialism takes the easy way out by merely eliminating the first infavourof the second,  making man a passive product entirely determined by economic circumstances.	verb	22
1332	1	Its corollary,  whereby praxis becomes determining history,  he called the ‘ inert ’,  by which he meant the material circumstances that have themselves been created by previous praxes and which form the conditions for new praxis.	verb	11
1333	1	Though this neatly solves the problem of how man can make history while at the same time history makes him,  it does not answer the larger question of how a multiplicity of the products of individual acts,  ‘ totalizations ’,  can themselves be totalized into the overall totalization required by the logic of dialectical rationality—  ratherthan being the arbitrary,  blind and self-cancelling movements of,  say,  Hardy 's immanent will.	verb	59
1334	1	Sartre 's fundamental thesis,  that ‘ History continually effects totalisations of totalisations ’ ( I,  15 ),  does not in itself answer what Ronald Aronson has rightly characterized as question for Sartre:  ‘ how do separate,  antagonistic actions yield history;  how do individual totalizations lead to Totalization ( and also progress,  the direction of history,  its truth and its meaning )? ’	verb	36
1335	1	The dialectic is the law of totalization which creates collectivities,  societies,  and history—  realities,  thatis,  which impose themselves on individuals;  but at the same time it must be woven outof millions of individual actions.	verb	28
1336	1	At the moment,  ‘ history is made without being known history constitutes,  we might say today,  a political unconscious.	verb	18
1337	1	‘ Marxism ’,  on the other hand,  Sartre claims,  ‘ is History itself becoming conscious of itself ’ ( I,  40 ):  asfor Lukács,  it is by becoming conscious of itself as the subject of history that the working class will understand history 's meaning—  and so recognize itself as the meaning of history.	verb	14
1338	1	‘ Marxism ’,  on the other hand,  Sartre claims,  ‘ is History itself becoming conscious of itself ’ ( I,  40 ):  asfor Lukács,  it is by becoming conscious of itself as the subject of history that the working class will understand history 's meaning—  and so recognize itself as the meaning of history.	verb	28
1339	1	While he suggests in apocalyptic tones in that this process of self-consciousness is atlast beginning to take place,  and that civil,  foreign and colonial wars are becoming apparent as different forms of a single class struggle,  Sartre also admits that the divorce between theory and praxis which ensued under Stalinism has generally prevented any clear self-consciousness among the masses.	verb	5
1340	1	While he suggests in apocalyptic tones in that this process of self-consciousness is atlast beginning to take place,  and that civil,  foreign and colonial wars are becoming apparent as different forms of a single class struggle,  Sartre also admits that the divorce between theory and praxis which ensued under Stalinism has generally prevented any clear self-consciousness among the masses.	verb	41
1341	1	The ‘ detour,  of Stalinism is thus formalized as Marxism 's own descent into its unconscious,  resulting in a dream-work of heterogeneous histories that have eluded systematization and subsumption into the single meaning of Marxism 's own reading of history.	verb	19
1342	1	The ‘ detour,  of Stalinism is thus formalized as Marxism 's own descent into its unconscious,  resulting in a dream-work of heterogeneous histories that have eluded systematization and subsumption into the single meaning of Marxism 's own reading of history.	verb	25
1343	1	It is therefore,  Sartre argues,  our historical task to make it known,  promoting not just the historical process as such,  but also the general recognition whereby the plurality of the meanings of individual histories can be seen to combine to make one history,  with one meaning—  the ‘ Truth of humanity ’ ( I,  822 ).	verb	24
1344	1	Sartre 's account thus sets up the articulation of history,  univocal meaning,  and totality as the indissoluble set of elements required for the validation of Marxism,  necessary inorder to save it from its detour from itself.	verb	19
1345	1	Sartre 's account thus sets up the articulation of history,  univocal meaning,  and totality as the indissoluble set of elements required for the validation of Marxism,  necessary inorder to save it from its detour from itself.	verb	33
1346	1	How can History be a unity if it is also conflictual,  if each action is aimed at destroying the other and results in a double negation in which the original aims of each action have been destroyed by the other?	verb	25
1347	1	How can History be a unity if it is also conflictual,  if each action is aimed at destroying the other and results in a double negation in which the original aims of each action have been destroyed by the other?	verb	36
1348	1	Sartre produces a persuasive formulation of the relation of the individual to the determining historical circumstance through his concepts of praxis and the inert;  it is also obvious to him how the larger question of History ought to be solved.	verb	4
1349	1	He attempts to solve this through matching his account of contradiction with a new concept derived from the conjunction of work and labour:  ‘ anti-labour ’ ( ),  a category of negation.	verb	15
1350	1	He attempts to solve this through matching his account of contradiction with a new concept derived from the conjunction of work and labour:  ‘ anti-labour ’ ( ),  a category of negation.	verb	31
1351	1	The products of a conflict,  aswellas its residues,  may seem incomprehensible insofaras they differ from the original intentions of any of the combatants.	verb	7
1352	1	The products of a conflict,  aswellas its residues,  may seem incomprehensible insofaras they differ from the original intentions of any of the combatants.	verb	22
1353	1	—because  they seem to be atonce the results of a communal enterprise while at the same time bearing witness to the fact that this enterprise never existed except as the inhuman reverse side of two opposed actions in which each aims to destroy the other.	verb	18
1354	1	In the dialectical perspective,  we encounter these objects as productions which are human and provided with a future…  thus they seem by themselves to be totalizations in process.	verb	3
1355	1	This means that first,  they lead to results,  and second,  that the internal structure of social objects contains ‘ the double negation of themselves and of each constituent part by the other ’ ( II,  22 ).	verb	13
1356	1	This means that first,  they lead to results,  and second,  that the internal structure of social objects contains ‘ the double negation of themselves and of each constituent part by the other ’ ( II,  22 ).	verb	21
1357	1	There is,  therefore,  before any understanding of historic agents and movements,  a certain in all social ensembles:  from afar they may appear whole,  but close to,  they can be seen as riddled with holes.	verb	10
1358	1	There is,  therefore,  before any understanding of historic agents and movements,  a certain in all social ensembles:  from afar they may appear whole,  but close to,  they can be seen as riddled with holes.	verb	31
1359	1	In the context of the negativity of this formulation,  Sartre is obliged to pose onceagain the problem of whether there can be a totalization,  without any independent totalizer or totalizing force suchas the dialectic,  or whether the structure of negation that he has described means that,  asfor Adorno or Bakhtin,  history does not develop positively but,  rather,  negatively,  and is therefore instead detotalizing:	verb	8
1360	1	In the context of the negativity of this formulation,  Sartre is obliged to pose onceagain the problem of whether there can be a totalization,  without any independent totalizer or totalizing force suchas the dialectic,  or whether the structure of negation that he has described means that,  asfor Adorno or Bakhtin,  history does not develop positively but,  rather,  negatively,  and is therefore instead detotalizing:	verb	39
1361	1	Marxism is rigorously true if History is totalization;  it is not so any more if human history decomposes into a plurality of particular histories,  or if,  in any case,  within the relationship of immanence that characterizes struggle,  the negation of each adversary by the other is on principle.	verb	17
1362	1	Marxism is rigorously true if History is totalization;  it is not so any more if human history decomposes into a plurality of particular histories,  or if,  in any case,  within the relationship of immanence that characterizes struggle,  the negation of each adversary by the other is on principle.	verb	31
1363	1	Marxism is rigorously true if History is totalization;  it is not so any more if human history decomposes into a plurality of particular histories,  or if,  in any case,  within the relationship of immanence that characterizes struggle,  the negation of each adversary by the other is on principle.	verb	38
1364	1	Marxism is rigorously true if History is totalization;  it is not so any more if human history decomposes into a plurality of particular histories,  or if,  in any case,  within the relationship of immanence that characterizes struggle,  the negation of each adversary by the other is on principle.	verb	41
1365	1	Our goal is solely to establish whether,  in a practical ensemble torn apart by antagonism ( whether there are multiple conflicts or whether they are reduced to one ) the breaks themselves are totalizing and carried along by the totalizing movement of the ensemble.	verb	10
1366	1	At this point Sartre confronts the possibility that the whole project of the,  stated so confidently on its very first page—  ‘ it must be proved that a negation of a negation can be an affirmation ’ ( I,  15 )—  may break down.	verb	4
1367	1	At this point Sartre confronts the possibility that the whole project of the,  stated so confidently on its very first page—  ‘ it must be proved that a negation of a negation can be an affirmation ’ ( I,  15 )—  may break down.	verb	28
1368	1	At this point Sartre confronts the possibility that the whole project of the,  stated so confidently on its very first page—  ‘ it must be proved that a negation of a negation can be an affirmation ’ ( I,  15 )—  may break down.	verb	31
1369	1	perhaps the Truth of History can not be proved;  its direction can not be discerned.	verb	14
1370	1	Sartre 's reaction to the threat that the negation of a negation may produce a detotalizing effect is to introduce a new category,  a unifying force of a ‘ singularization ’ which incarnates the universal:  ‘ If totalization really is an ongoing process ’,  he writes,  ‘ then it operates everywhere.	verb	11
1371	1	That means both that there is a dialectical meaning of the practical ensemble…  and that each singular event totalizes in itself the practical ensemble in the infinite richness of its singularity ’ ( II,  26 ).	verb	27
1372	1	Unlike Lukács ' insignificant event from which the universal is precariously drawn out through the narrative,  Sartre 's singularity works synecdochally in a conventional antinomy with the universal,  the relation between the two structured accordingto the familiar nineteenth-century model of organic growth or process in which each singular event makes up the whole while,  as he puts it,  ‘ the whole is entirely present in the part as its present meaning and as its destiny ’.	verb	40
1373	1	Sartre 's ‘ singular universal ’,  therefore,  begs the question,  for it is predicated on the assumption that,  if there is not a totality as such,  then there already is an overall totalization:  ‘ If totalization really is an ongoing process… ’.	verb	7
1374	1	That developing process is itself totalized through Sartre 's assertion that each totalization is the totalization of all struggles,  as it must be if the singular is to incarnate the universal.	verb	28
1375	1	In this case Sartre demonstrates how the singular universal works,  by appealing to the concrete example of a boxing match—  a random exemplification that just happens to reproduce the single adversaries of the master/slave dialectic.	verb	14
1376	1	In this case Sartre demonstrates how the singular universal works,  by appealing to the concrete example of a boxing match—  a random exemplification that just happens to reproduce the single adversaries of the master/slave dialectic.	verb	27
1377	1	In this case Sartre demonstrates how the singular universal works,  by appealing to the concrete example of a boxing match—  a random exemplification that just happens to reproduce the single adversaries of the master/slave dialectic.	verb	30
1378	1	Its totalization takes place through its incarnation,  as part of the totality of boxing,  in the overall framework within which each individual fight occurs.	verb	6
1379	1	Each boxing match,  Sartre claims,  must be both a unique event and also in some sense the incarnation of all boxing,  whose rules and conventions it follows,  and whose past and future history it sets itself against.	verb	17
1380	1	Yet each individual bout articulates itself within the framework of the history of boxing,  known and unknown.	verb	4
1381	1	The boxing match ‘ is the public incarnation of conflict ’ ( II,  32 ),  totalizing in its own struggle the whole of ‘ contemporary irreducibilities and fissures ’ ( II,  26 ):	verb	7
1382	1	The boxing match ‘ is the public incarnation of conflict ’ ( II,  32 ),  totalizing in its own struggle the whole of ‘ contemporary irreducibilities and fissures ’ ( II,  26 ):	verb	27
1383	1	thus one can and must say…  that each fight is the singularisation of all of the social whole in movement and that by this singularisation,  it incarnates the enveloping totalization which the historical process is.	verb	26
1384	1	thus one can and must say…  that each fight is the singularisation of all of the social whole in movement and that by this singularisation,  it incarnates the enveloping totalization which the historical process is.	verb	28
1385	1	But then he adds,  ‘ I have said and I repeat that we have not yet proved that this enveloping totalization exists ’.	verb	19
1386	1	So,  although it is possible to conceive of any event as an incarnation of the totality,  insofaras it must itself make up a part of that totality in its determination,  unlike the case of the boxing match,  where we can define the overall entity ‘ boxing ’,  it still remains unproven that an overall entity,  ‘ History ’,  can be said to exist atall.	verb	12
1387	1	It is simple enough for him to show that a boxing match takes place within a general totality of ‘ boxing ’,  which is itself only ever present in any individual incarnation,  for as a game each match is both an individual bout and something conducted accordingto general rules and a specific social tradition.	verb	31
1388	1	But what about those conflicts that do not take place within such a constituted social system,  such as conflictual bourgeois societies which can not be said to be unified,  except,  as Sartre suggests dismissively,  by appeal to a lost paradise before the class struggle?	verb	43
1389	1	His difficulty is accompanied by a nodoubt symptomatic increasing distrust of universals sothat,  in championing specificities against them,  he seems to give up the attempt to validate the universals—  History as Totalization—  that originally formed the object of his project.	verb	3
1390	1	His difficulty is accompanied by a nodoubt symptomatic increasing distrust of universals sothat,  in championing specificities against them,  he seems to give up the attempt to validate the universals—  History as Totalization—  that originally formed the object of his project.	verb	7
1391	1	His difficulty is accompanied by a nodoubt symptomatic increasing distrust of universals sothat,  in championing specificities against them,  he seems to give up the attempt to validate the universals—  History as Totalization—  that originally formed the object of his project.	verb	36
